{
  "$schema": "http://json-schema.org/draft-07/schema#",
  "title": "ARI ExecutionTrace",
  "description": "Draft, non-normative portable record of one RuntimePlan execution.",
  "type": "object",
  "additionalProperties": false,
  "required": ["trace_id", "runtime_plan_id", "started_at", "completed_at", "events", "tool_calls", "provider_calls", "policy_decisions", "errors", "final_status"],
  "properties": {
    "trace_id": {"type": "string"},
    "runtime_plan_id": {"type": "string"},
    "input": {"type": ["string", "null"]},
    "started_at": {"type": ["integer", "null"]},
    "completed_at": {"type": ["integer", "null"]},
    "events": {
      "type": "array",
      "items": {
        "type": "object",
        "required": ["type"],
        "properties": {"type": {"type": "string"}}
      }
    },
    "tool_calls": {"type": "array", "items": {"type": "object"}},
    "provider_calls": {"type": "array", "items": {"type": "object"}},
    "policy_decisions": {"type": "array", "items": {"type": "object"}},
    "errors": {"type": "array", "items": {"type": "object"}},
    "final_status": {"type": "string", "enum": ["completed", "error", "exhausted"]}
  }
}
